Title,Author(s),Publication Year,Publication Source,Retrieval Link
Agile Teams' Perception in Privacy Requirements Elicitation: LGPD's compliance in Brazil,"Edna Dias Canedo, Angelica Toffano Seidel Calazans, Anderson Jefferson Cerqueira, Pedro Henrique Teixeira Costa, Eloisa Toffano Seidel Masson",2021,Requirements Engineering - Research Papers,https://conf.researchr.org/track/RE-2021/RE-2021-papers?#event-overview
Ambiguity and Generality in Natural Language Privacy Policies,"Mitra Bokaei Hosseini, John Heaps, Rocky Slavin, Travis Breaux, Jianwei Niu",2021,Requirements Engineering - Research Papers,https://conf.researchr.org/track/RE-2021/RE-2021-papers?#event-overview
A Survey of Instructional Approaches in the Requirements Engineering Education Literature,"Marian Daun, Alicia M. Grubb, Bastian Tenbergen",2021,Requirements Engineering - Research Papers,https://conf.researchr.org/track/RE-2021/RE-2021-papers?#event-overview
Automated Traceability for Domain Modelling Decisions Empowered by Artificial Intelligence,"Rijul Saini, Gunter Mussbacher, Jin L.C. Guo, Jörg Kienzle",2021,Requirements Engineering - Research Papers,https://conf.researchr.org/track/RE-2021/RE-2021-papers?#event-overview
Classifying User Requirements from Online Feedback in Small Dataset Environments using Deep Learning,"Rohan Reddy Mekala, Asif Irfan, Eduard C. Groen, Adam Porter, Mikael Lindvall",2021,Requirements Engineering - Research Papers,https://conf.researchr.org/track/RE-2021/RE-2021-papers?#event-overview
Design Decisions in the Construction of Traceability Information Models for Safe Automotive Systems,"Jan-Philipp Steghöfer, Björn Koopmann, Jan Steffen Becker, Mikaela Törnlund, Yulla Ibrahim, Mazen Mohamad",2021,Requirements Engineering - Research Papers,https://conf.researchr.org/track/RE-2021/RE-2021-papers?#event-overview
Environment-Driven Abstraction Identification for Requirements-Based Testing,"Zedong Peng, Prachi Rathod, Nan Niu, Tanmay Bhowmik, Hui Liu, Lin Shi, Zhi Jin",2021,Requirements Engineering - Research Papers,https://conf.researchr.org/track/RE-2021/RE-2021-papers?#event-overview
"Exploring Explainability:  A Definition, a Model, and a Knowledge Catalogue","Larissa Chazette, Wasja Brunotte, Timo Speith",2021,Requirements Engineering - Research Papers,https://conf.researchr.org/track/RE-2021/RE-2021-papers?#event-overview
From Ideas to Expressed Needs: an Empirical Study on the Evolution of Requirements during Elicitation,"Sourav Debnath, Paola Spoletini, Alessio Ferrari",2021,Requirements Engineering - Research Papers,https://conf.researchr.org/track/RE-2021/RE-2021-papers?#event-overview
From Screenplays to Podcasts – New Perspectives on Improving Requirements Communication in Interdisciplinary Teams,"Anne Hess, Jill Tamanini, Sven Storck",2021,Requirements Engineering - Research Papers,https://conf.researchr.org/track/RE-2021/RE-2021-papers?#event-overview
Non-functional Requirements for Machine Learning:  Understanding Current Use and Challenges in Industry,"Khan Mohammad Habibullah, Jennifer Horkoff",2021,Requirements Engineering - Research Papers,https://conf.researchr.org/track/RE-2021/RE-2021-papers?#event-overview
On the impact of using different templates on creating and understanding user stories,"Catarina Gralha, Rita Pereira, Miguel Goulao, João Araújo",2021,Requirements Engineering - Research Papers,https://conf.researchr.org/track/RE-2021/RE-2021-papers?#event-overview
On the Role of User Feedback in Software Evolution: a Practitioners' Perspective,"Simon van Oordt, Emitzá Guzmán",2021,Requirements Engineering - Research Papers,https://conf.researchr.org/track/RE-2021/RE-2021-papers?#event-overview
Perspectives on Compliance Requirements in Software Engineering,"Evelyn Kempe, Aaron Massey",2021,Requirements Engineering - Research Papers,https://conf.researchr.org/track/RE-2021/RE-2021-papers?#event-overview
Reddit as a New Source of User Feedback for Software Requirements,"Tahira Iqbal, Moniba Iqbal, Kuldar Taveter, Norbert Seyff",2021,Requirements Engineering - Research Papers,https://conf.researchr.org/track/RE-2021/RE-2021-papers?#event-overview
TEM: A Transparency Engineering Methodology Enabling Users’ Trust Judgement,"Baraa Zieni, Reiko Heckel",2021,Requirements Engineering - Research Papers,https://conf.researchr.org/track/RE-2021/RE-2021-papers?#event-overview
The practical role of context modeling in the elicitation of context-aware functionalities: a survey,"Rodrigo Falcão, Karina Villela, Vaninha Vieira, Marcus Trapp, Igor Lopes de Faria",2021,Requirements Engineering - Research Papers,https://conf.researchr.org/track/RE-2021/RE-2021-papers?#event-overview
The Rise and Fall of COVID-19 Contact-Tracing Apps: when NFRs Collide with Pandemic,"Muneera Bano, Chetan Arora, Didar Zowghi, Alessio Ferrari",2021,Requirements Engineering - Research Papers,https://conf.researchr.org/track/RE-2021/RE-2021-papers?#event-overview
The Role of Linguistic Relativity on the Identification of Sustainability Requirements: An Empirical Study,"Yen Dieu Pham, Abir Bouraffa, Marleen Hillen, Walid Maalej",2021,Requirements Engineering - Research Papers,https://conf.researchr.org/track/RE-2021/RE-2021-papers?#event-overview
Towards Achieving Trust Through Transparency and Ethics,"David Kwan, Luiz Marcio Cysneiros, Julio Cesar Leite",2021,Requirements Engineering - Research Papers,https://conf.researchr.org/track/RE-2021/RE-2021-papers?#event-overview
Unsupervised Topic Discovery in User Comments,"Christoph Stanik, Tim Pietz, Walid Maalej",2021,Requirements Engineering - Research Papers,https://conf.researchr.org/track/RE-2021/RE-2021-papers?#event-overview
What’s up with Requirements Engineering for Artificial Intelligence Systems?,"Khlood Ahmad, Muneera Bano, Mohamed Abdelrazek, Chetan Arora, John Grundy",2021,Requirements Engineering - Research Papers,https://conf.researchr.org/track/RE-2021/RE-2021-papers?#event-overview
What the open domain model can tell us about the missing software requirements: A Preliminary study,"Ziyan Zhao, Xiaoli Lian, Li Zhang",2021,Requirements Engineering - Research Papers,https://conf.researchr.org/track/RE-2021/RE-2021-papers?#event-overview
A Case Study of Building Shared Understanding of Non-Functional Requirements in a Remote Software Organization,"Laura Okpara, Colin Werner, Adam R Murray, Daniela Damian",2022,Requirements Engineering - Research Papers,https://conf.researchr.org/track/RE-2022/RE-2022-Research-Papers?#event-overview
A Divide & Concur Approach to Collaborative Goal Modeling with Merge in Early-RE,"Kathleen R. Hablutzel, Anisha Jain, Alicia M. Grubb",2022,Requirements Engineering - Research Papers,https://conf.researchr.org/track/RE-2022/RE-2022-Research-Papers?#event-overview
Automated Detection of Typed Links in Issue Trackers,"Clara Marie Lüders, Tim Pietz, Walid Maalej",2022,Requirements Engineering - Research Papers,https://conf.researchr.org/track/RE-2022/RE-2022-Research-Papers?#event-overview
Automated Question Answering for Improved Understanding of Compliance Requirements: A Multi-Document Study,"Sallam Abualhaija, Chetan Arora, Amin Sleimi, Lionel Briand",2022,Requirements Engineering - Research Papers,https://conf.researchr.org/track/RE-2022/RE-2022-Research-Papers?#event-overview
Automatic Terminology Extraction and Ranking for Feature Modeling,"Jianzhang Zhang, Sisi Chen, Jinping Hua, Nan Niu, Chuang Liu",2022,Requirements Engineering - Research Papers,https://conf.researchr.org/track/RE-2022/RE-2022-Research-Papers?#event-overview
CADE: The Missing Benchmark in Evaluating Dataset Requirements of AI-enabled Software,"Mona Rahimi, Hamed Barzamini",2022,Requirements Engineering - Research Papers,https://conf.researchr.org/track/RE-2022/RE-2022-Research-Papers?#event-overview
Enriching Vision Videos with Text: An Eye Tracking Study,"Melanie Schmedes, Maike Ahrens, Lukas Nagel, Kurt Schneider",2022,Requirements Engineering - Research Papers,https://conf.researchr.org/track/RE-2022/RE-2022-Research-Papers?#event-overview
Hierarchical Assessment of Safety Requirements for Configurations of Autonomous Driving Systems,"Yixing Luo, Xiao-Yi Zhang, Paolo Arcaini, Zhi Jin, Haiyan Zhao, Linjuan Zhang, Fuyuki Ishikawa",2022,Requirements Engineering - Research Papers,https://conf.researchr.org/track/RE-2022/RE-2022-Research-Papers?#event-overview
Legal Accountability as Software Quality: A U.S. Data Processing Perspective,"Travis Breaux, Thomas Norton",2022,Requirements Engineering - Research Papers,https://conf.researchr.org/track/RE-2022/RE-2022-Research-Papers?#event-overview
Mining User Feedback For Software Engineering: Use Cases and Reference Architecture,"Jacek Dąbrowski, Emmanuel Letier, Anna Perini, Angelo Susi",2022,Requirements Engineering - Research Papers,https://conf.researchr.org/track/RE-2022/RE-2022-Research-Papers?#event-overview
Narratives: the Unforeseen Influencer of Privacy Concerns,"Ze Shi (Zane) Li, Manish Sihag, Nowshin Nawar Arony, Joao Bezerra Junior, Thanh Phan, Neil Ernst, Daniela Damian",2022,Requirements Engineering - Research Papers,https://conf.researchr.org/track/RE-2022/RE-2022-Research-Papers?#event-overview
Requirements on Explanations: A Quality Framework for Explainability,"Larissa Chazette, Verena Klös, Florian Herzog, Kurt Schneider",2022,Requirements Engineering - Research Papers,https://conf.researchr.org/track/RE-2022/RE-2022-Research-Papers?#event-overview
RESAM: Requirements Elicitation and Specification for Deep-Learning Anomaly Models with Applications to UAV Flight Controllers,"Md Nafee Al Islam, Yihong Ma, Pedro Alarcon Granadeno, Nitesh Chawla, Jane Cleland-Huang",2022,Requirements Engineering - Research Papers,https://conf.researchr.org/track/RE-2022/RE-2022-Research-Papers?#event-overview
The Benefits of Pre-Requirements Specification Traceability,"Julia Mucha, Andreas Kaufmann, Dirk Riehle, Martin Jung",2022,Requirements Engineering - Research Papers,https://conf.researchr.org/track/RE-2022/RE-2022-Research-Papers?#event-overview
"The Implications of ""Soft Requirements""","Alistair Sutcliffe, Peter Sawyer, Nelly Bencomo",2022,Requirements Engineering - Research Papers,https://conf.researchr.org/track/RE-2022/RE-2022-Research-Papers?#event-overview
What's Inside a Cluster of Software User Feedback: A Study of Characterisation Methods,"Peter Devine, James Tizard, Hechen Wang, Yun Sing Koh, Kelly Blincoe",2022,Requirements Engineering - Research Papers,https://conf.researchr.org/track/RE-2022/RE-2022-Research-Papers?#event-overview
A Comparative Evaluation of Requirement Template Systems,"Katharina Großer, Marina Rukavitsyna, Jan Jürjens",2023,Requirements Engineering - Research Papers,https://conf.researchr.org/track/RE-2023/RE-2023-Research-Papers?#event-overview
A Data-Driven Approach for Finding Requirements Relevant Feedback from TikTok and YouTube,"Manish Sihag, Ze Shi Li, Amanda Dash, Nowshin Nawar Arony, Kezia Devathasan, Neil Ernst, Alexandra Albu, Daniela Damian",2023,Requirements Engineering - Research Papers,https://conf.researchr.org/track/RE-2023/RE-2023-Research-Papers?#event-overview
All Eyes on Traceability: An Interview Study on Industry Practices and Eye Tracking Potential,"Maike Ahrens, Lukas Nagel",2023,Requirements Engineering - Research Papers,https://conf.researchr.org/track/RE-2023/RE-2023-Research-Papers?#event-overview
Analysis and optimisation of SPL products using goal models,"Inmaculada Ayala, Mercedes Amor, Lidia Fuentes",2023,Requirements Engineering - Research Papers,https://conf.researchr.org/track/RE-2023/RE-2023-Research-Papers?#event-overview
An Experiment on the Effects of using Color to Visualize Requirements Analysis Tasks,"Yesugen Baatartogtokh, Irene Foster, Alicia M. Grubb",2023,Requirements Engineering - Research Papers,https://conf.researchr.org/track/RE-2023/RE-2023-Research-Papers?#event-overview
A Requirements-Driven Platform for Validating Field Operations of Small Uncrewed Aerial Vehicles,"Ankit Agrawal, Bohan Zhang, Yashaswini Shivalingaiah, Michael Vierhauser, Jane Cleland-Huang",2023,Requirements Engineering - Research Papers,https://conf.researchr.org/track/RE-2023/RE-2023-Research-Papers?#event-overview
A Transformer-based Approach for Abstractive Summarization of  Requirements from Obligations in Software Engineering Contracts,"Chirag Jain, Preethu Rose Anish, Amrita Singh, Smita Ghaisas",2023,Requirements Engineering - Research Papers,https://conf.researchr.org/track/RE-2023/RE-2023-Research-Papers?#event-overview
Eliciting the Double-edged Impact of Digitalisation: a Case Study in Rural Areas,"Alessio Ferrari, Fabio Lepore, Livia Ortolani, Gianluca Brunori",2023,Requirements Engineering - Research Papers,https://conf.researchr.org/track/RE-2023/RE-2023-Research-Papers?#event-overview
ML-based Compliance Verification of Data Processing Agreements against GDPR,"Orlando Amaral, Sallam Abualhaija, Lionel Briand",2023,Requirements Engineering - Research Papers,https://conf.researchr.org/track/RE-2023/RE-2023-Research-Papers?#event-overview
Mobile Application Privacy Risk Assessments from User-authored Scenarios,"Tianjian Huang, Vaishnavi Kaulagi, Mitra Bokaei Hosseini, Travis Breaux",2023,Requirements Engineering - Research Papers,https://conf.researchr.org/track/RE-2023/RE-2023-Research-Papers?#event-overview
Prompting Creative Requirements via Traceable and Adversarial Examples in Deep Learning,"Hemanth Gudaparthi, Nan Niu, Boyang Wang, Tanmay Bhowmik, Hui Liu, Jianzhang Zhang, Juha Savolainen, Glen Horton, Sean Crowe, Thomas Scherz, Lisa Haitz",2023,Requirements Engineering - Research Papers,https://conf.researchr.org/track/RE-2023/RE-2023-Research-Papers?#event-overview
Quantifying Requirements Technical Debt: A Systematic Mapping Study and a Conceptual Model,"Judith Perera, Ewan Tempero, Yu-Cheng Tu, Kelly Blincoe",2023,Requirements Engineering - Research Papers,https://conf.researchr.org/track/RE-2023/RE-2023-Research-Papers?#event-overview
Synthesized data quality requirements and roadmap for improving reusability of in-situ marine data,"Ngoc-Thanh Nguyen, Keila Lima, Astrid Marie Skalvik, Rogardt Heldal, Eric Knauss, Tosin Daniel Oyetoyan, Patrizio Pelliccione, Camilla Sætre",2023,Requirements Engineering - Research Papers,https://conf.researchr.org/track/RE-2023/RE-2023-Research-Papers?#event-overview
User Driven Functionality Deletion for Mobile Apps,"Maleknaz Nayebi, Konstantin Kuznetsov, Andreas Zeller, Guenther Ruhe",2023,Requirements Engineering - Research Papers,https://conf.researchr.org/track/RE-2023/RE-2023-Research-Papers?#event-overview
Zero-shot Learning for Named Entity Recognition in Software Specification Documents,"Souvick Das, Novarun Deb, Agostino Cortesi, Nabendu Chaki",2023,Requirements Engineering - Research Papers,https://conf.researchr.org/track/RE-2023/RE-2023-Research-Papers?#event-overview
An Anatomy of Security Conversations in Stack Overflow,"Tamara Lopez, Thein Tun, Arosha K Bandara, Mark Levine, Bashar Nuseibeh, Helen Sharp",2019,ICSE - Software Engineering in Society,https://conf.researchr.org/track/icse-2019/icse-2019-Software-Engineering-in-Society#event-overview
Architecture Design Decision Maps for Software Sustainability,Patricia Lago,2019,ICSE - Software Engineering in Society,https://conf.researchr.org/track/icse-2019/icse-2019-Software-Engineering-in-Society#event-overview
Beyond the Code Itself: How Programmers Really Look at Pull Requests,"Denae Ford, Mahnaz (Mana) Behroozi, Alexander Serebrenik, Chris Parnin",2019,ICSE - Software Engineering in Society,https://conf.researchr.org/track/icse-2019/icse-2019-Software-Engineering-in-Society#event-overview
Gender Diversity and Women in Software Teams: How Do They Affect Community Smells?,"Gemma Catolino, Fabio Palomba, Damian Andrew Tamburri, Alexander Serebrenik, Filomena Ferrucci",2019,ICSE - Software Engineering in Society,https://conf.researchr.org/track/icse-2019/icse-2019-Software-Engineering-in-Society#event-overview
Implicit Gender Biases in Professional Software Development: An Empirical Study,"Yi Wang, David Redmiles",2019,ICSE - Software Engineering in Society,https://conf.researchr.org/track/icse-2019/icse-2019-Software-Engineering-in-Society#event-overview
Software Engineering in Civic Tech: A Case Study about Code for Ireland,"Antti Knutas, Victoria Palacin, Giovanni Maccani, Markus Helfert",2019,ICSE - Software Engineering in Society,https://conf.researchr.org/track/icse-2019/icse-2019-Software-Engineering-in-Society#event-overview
Terraforming Earth: Will software experiments guide us out of the climate crisis?,Steve Easterbrook,2019,ICSE - Software Engineering in Society,https://conf.researchr.org/track/icse-2019/icse-2019-Software-Engineering-in-Society#event-overview
Trust beyond computation alone: Human aspects of trust in blockchain technologies,"Barnaby Craggs, Awais Rashid",2019,ICSE - Software Engineering in Society,https://conf.researchr.org/track/icse-2019/icse-2019-Software-Engineering-in-Society#event-overview
Building Trust in the Untrustable,"Emilia Cioroaica, Barbora Buhnova, Thomas Kuhn, Daniel Schneider",2020,ICSE - Software Engineering in Society,https://2020.icse-conferences.org/track/icse-2020-Software-Engineering-in-Society#event-overview
Debugging Hiring: What Went Right and What Went Wrong in the Technical Interview Process,"Mahnaz (Mana) Behroozi, Shivani Shirolkar, Titus Barik, Chris Parnin",2020,ICSE - Software Engineering in Society,https://2020.icse-conferences.org/track/icse-2020-Software-Engineering-in-Society#event-overview
Deep Learning for Smart Sewer Systems: Assessing Nonfunctional Requirements,"Hemanth Gudaparthi, Reese Johnson, Harshitha Challa, Nan Niu",2020,ICSE - Software Engineering in Society,https://2020.icse-conferences.org/track/icse-2020-Software-Engineering-in-Society#event-overview
Designing Edutainment Software for Digital Skills Nurturing of Preschoolers. A Method Proposal.,"Adriana-Mihaela Guran, Grigoreta Sofia Cojocar, Anamaria Moldovan",2020,ICSE - Software Engineering in Society,https://2020.icse-conferences.org/track/icse-2020-Software-Engineering-in-Society#event-overview
Developing Software for Motivating Individuals with Intellectual Disabilities to do Outdoor Physical Activity,"Juan C Torrado, Ida Wold, Letizia Jaccheri, Susanna Pelagatti, Stefano Chessa, Javier Gomez, Gunnar Hartvigsen, Henriette Michalsen",2020,ICSE - Software Engineering in Society,https://2020.icse-conferences.org/track/icse-2020-Software-Engineering-in-Society#event-overview
From Abstract Specifications to Application Generation,"José Miguel Pérez-Álvarez, Adrian Mos",2020,ICSE - Software Engineering in Society,https://2020.icse-conferences.org/track/icse-2020-Software-Engineering-in-Society#event-overview
"From RE Cares to SE Cares: Software Engineering for Social Good, One Venue at a Time","Alex Dekhtyar, Jane Hayes, Jennifer Horkoff, Gunter Mussbacher, Irit Hadar, Meira Levy, Tingting Yu, Jared Payne, Barbara Paech, Kim Youngjoon, Jo Eunjung, Heo Seungbum, Kim Youngjoon, Kim Youngjoon, Kim Youngjoon",2020,ICSE - Software Engineering in Society,https://2020.icse-conferences.org/track/icse-2020-Software-Engineering-in-Society#event-overview
How layered reuse can support harmful micropolitics: SAP ERP in surgery planning,"Dzifa Ametowobla, Lutz Prechelt",2020,ICSE - Software Engineering in Society,https://2020.icse-conferences.org/track/icse-2020-Software-Engineering-in-Society#event-overview
Human Behaviour Centered Design: Developing a Software System for Cultural Heritage,"Julie Dugdale, Mahyar Tourchi Moghaddam, Henry Muccini",2020,ICSE - Software Engineering in Society,https://2020.icse-conferences.org/track/icse-2020-Software-Engineering-in-Society#event-overview
Is Using Deep Learning Frameworks Free? Characterizing Technical Debt in Deep Learning Frameworks,"Jiakun Liu, Qiao Huang, Xin Xia, Emad Shihab, David Lo, Shanping Li",2020,ICSE - Software Engineering in Society,https://2020.icse-conferences.org/track/icse-2020-Software-Engineering-in-Society#event-overview
Keynote: It Is Time We Made Software Development Accessible to People with Disabilities,Andreas Stefik,2020,ICSE - Software Engineering in Society,https://2020.icse-conferences.org/track/icse-2020-Software-Engineering-in-Society#event-overview
Refactoring Community Smells in the Wild: The Practitioner’s Field Manual,"Gemma Catolino, Fabio Palomba, Damian Andrew Tamburri, Alexander Serebrenik, Filomena Ferrucci",2020,ICSE - Software Engineering in Society,https://2020.icse-conferences.org/track/icse-2020-Software-Engineering-in-Society#event-overview
Society-Oriented Applications Development: Investigating Users' Values from Bangladeshi Agriculture Mobile Applications,"Rifat Ara Shams, Waqar Hussain, Gillian Oliver, Harsha Perera, Arif Nurwidyantoro, Jon Whittle",2020,ICSE - Software Engineering in Society,https://2020.icse-conferences.org/track/icse-2020-Software-Engineering-in-Society#event-overview
A First Look at Human Values-Violation in  App Reviews,"Humphrey Obie, Waqar Hussain, Xin Xia, John Grundy, Li Li, Burak Turhan, Jon Whittle, Mojtaba Shahin",2021,ICSE - SEIS - Software Engineering in Society,https://2021.icse-conferences.org/track/icse-2021-Software-Engineering-in-Society#event-overview
Awareness and Perception of Agile in Saudi Software Industry,"Fahad Altuwaijri, Maria Angela Ferrario",2021,ICSE - SEIS - Software Engineering in Society,https://2021.icse-conferences.org/track/icse-2021-Software-Engineering-in-Society#event-overview
COVID-19 Vs Social Media apps: Does privacy really matter?,"Omar Haggag, Sherif Haggag, John Grundy, Mohamed Abdelrazek",2021,ICSE - SEIS - Software Engineering in Society,https://2021.icse-conferences.org/track/icse-2021-Software-Engineering-in-Society#event-overview
Does Culture Matter? Impact of Individualism and Uncertainty Avoidance on App Reviews,"Ricarda Anna-Lena Fischer, Rita Walczuch, Emitzá Guzmán",2021,ICSE - SEIS - Software Engineering in Society,https://2021.icse-conferences.org/track/icse-2021-Software-Engineering-in-Society#event-overview
Exploring the Role of Creativity in Software Engineering,"Wouter Groeneveld, Laurens Luyten, Joost Vennekens, Kris Aerts",2021,ICSE - SEIS - Software Engineering in Society,https://2021.icse-conferences.org/track/icse-2021-Software-Engineering-in-Society#event-overview
Image-based Social Sensing: Combining AI and the Crowd to Mine Policy-Adherence Indicators from Twitter,"Virginia Negri, Dario Scuratti, Stefano Agresti, Donya Rooein, Gabriele Scalia, Jose Luis Fernandez-Marquez, Amudha Ravi Shankar, Mark Carman, Barbara Pernici",2021,ICSE - SEIS - Software Engineering in Society,https://2021.icse-conferences.org/track/icse-2021-Software-Engineering-in-Society#event-overview
Investigating the potential impact of values on requirements and software engineering,"Alistair Sutcliffe, Peter Sawyer, Wei Liu, Nelly Bencomo",2021,ICSE - SEIS - Software Engineering in Society,https://2021.icse-conferences.org/track/icse-2021-Software-Engineering-in-Society#event-overview
QFL: Data-Driven Feedback Loop to Manage Quality in Agile Development,"Lidia López, Alessandra Bagnato, Antonin Ahbervé, Xavier Franch",2021,ICSE - SEIS - Software Engineering in Society,https://2021.icse-conferences.org/track/icse-2021-Software-Engineering-in-Society#event-overview
Résumé-Driven Development: A Definition and Empirical Characterization,"Jonas Fritzsch, Marvin Wyrich, Justus Bogner, Stefan Wagner",2021,ICSE - SEIS - Software Engineering in Society,https://2021.icse-conferences.org/track/icse-2021-Software-Engineering-in-Society#event-overview
Understanding Community Smells Variability: A Statistical Approach,"Gemma Catolino, Fabio Palomba, Damian Andrew Tamburri, Alexander Serebrenik",2021,ICSE - SEIS - Software Engineering in Society,https://2021.icse-conferences.org/track/icse-2021-Software-Engineering-in-Society#event-overview
Understanding Emotions of Developer Community Towards Software Documentation,"Akhila Sri Manasa Venigalla, Sridhar Chimalakonda",2021,ICSE - SEIS - Software Engineering in Society,https://2021.icse-conferences.org/track/icse-2021-Software-Engineering-in-Society#event-overview
An Empirical Investigation on the Challenges Faced by Women in the Software Industry: A Case Study,"Bianca Trinkenreich, Ricardo Britto, Marco Gerosa, Igor Steinmacher",2022,ICSE - SEIS - Software Engineering in Society,https://conf.researchr.org/track/icse-2022/icse-2022-seis---software-engineering-in-society?#event-overview
A New Approach Towards Ensuring Gender Inclusive SE Job Advertisements,"Tanjila Kanij, John Grundy, Jennifer McIntosh, Anita Sarma, Gayatri Aniruddha",2022,ICSE - SEIS - Software Engineering in Society,https://conf.researchr.org/track/icse-2022/icse-2022-seis---software-engineering-in-society?#event-overview
"A Review of How Whistleblowing is Studied in Software Engineering, and the Implications for Research and Practice","Lucy Hunt, Maria Angela Ferrario",2022,ICSE - SEIS - Software Engineering in Society,https://conf.researchr.org/track/icse-2022/icse-2022-seis---software-engineering-in-society?#event-overview
Attracting and Retaining OSS contributors with a Maintainer Dashboard,"Mariam Guizani, Thomas Zimmermann, Anita Sarma, Denae Ford",2022,ICSE - SEIS - Software Engineering in Society,https://conf.researchr.org/track/icse-2022/icse-2022-seis---software-engineering-in-society?#event-overview
Detecting Interpersonal Conflict in Issues and Code Review: Cross Pollinating Open- and Closed-Source Approaches,"Huilian Sophie Qiu, Bogdan Vasilescu, Christian Kästner, Carolyn Egelman, Ciera Jaspan, Emerson Murphy-Hill",2022,ICSE - SEIS - Software Engineering in Society,https://conf.researchr.org/track/icse-2022/icse-2022-seis---software-engineering-in-society?#event-overview
